{
  "uhbs_version": "5.0.0",
  "target": {
    "name": "Cowrie (SSH :2222)",
    "class": "Low-Interaction",
    "profile_ref": "docs/conformance/labs/cowrie/low_interaction_ssh_full.yaml"
  },
  "evaluated_at": "2026-09-26",
  "auditor": "UHBS-Lab results-5.0.0 refresh (cowrie-ssh)",
  "modules": {
    "A": {
      "score": 16.56,
      "status": "PARTIAL",
      "notes": "",
      "complete": true,
      "weight": 0.3
    },
    "B": {
      "score": 60.0,
      "status": "PARTIAL",
      "notes": "",
      "complete": true,
      "weight": 0.15
    },
    "C": {
      "score": 0.0,
      "status": "PARTIAL",
      "notes": "",
      "complete": true,
      "weight": 0.25
    },
    "D": {
      "score": 0.0,
      "status": "GATE_FAILED",
      "notes": "",
      "complete": true,
      "critical_control_verdict": "GATE_FAILED"
    },
    "E": {
      "score": 100.0,
      "status": "PASSED",
      "notes": "",
      "complete": true,
      "weight": 0.1
    },
    "F": {
      "score": 70.0,
      "status": "PASSED",
      "notes": "",
      "complete": true,
      "weight": 0.2
    }
  },
  "weights": {
    "w_A": 0.3,
    "w_B": 0.15,
    "w_C": 0.25,
    "w_E": 0.1,
    "w_F": 0.2
  },
  "safety_gate": {
    "containment_score": 0.0,
    "delta_c": 0.5,
    "passed": false,
    "critical_control_verdict": "GATE_FAILED",
    "unauthorized_egress_leaks": 1
  },
  "uhqs": 18.98,
  "grade": "F",
  "notes": "Evaluation proof only. results-5.0.0 refresh of cowrie-ssh at fef0d620962e23194a9d34a048488f9c76c85835. scoring_model_id=uhqs-v5.0-critical-gate-diagnostic. Regraded under uhqs-v5.1-always-grade (always-grade; gate is \u03b4_C factor).",
  "scoring_model_id": "uhqs-v5.1-always-grade",
  "assessment_status": "COMPLETE",
  "critical_control_verdict": "GATE_FAILED",
  "containment_measured": true
}
